Headline,Sentiment
"Taylor Swift Announces 'Era's Tour' Dates Across North America",Positive
"Taylor Swift's Era's Tour Set to Kick Off in Los Angeles",Positive
"Fans Eagerly Await Taylor Swift's Era's Tour: What to Expect",Positive
"Taylor Swift Adds Extra Dates to Era's Tour Due to High Demand",Positive
"Excitement Builds as Taylor Swift's Era's Tour Approaches",Positive
"Taylor Swift Reveals Special Guests for Era's Tour Performances",Positive
"Tickets for Taylor Swift's Era's Tour Sell Out Within Minutes",Positive
"Behind the Scenes: Taylor Swift Prepares for Era's Tour Rehearsals",Positive
"Taylor Swift Unveils Setlist for Era's Tour: Hits and Surprises Await",Positive
"Security Measures Tightened for Taylor Swift's Era's Tour Amid Safety Concerns",Positive
"Controversy Surrounds Taylor Swift's Era's Tour: Critics Question Ticket Pricing",Negative
"Some Fans Disappointed with Ticket Availability for Taylor Swift's Era's Tour",Negative
"Taylor Swift Faces Backlash Over Era's Tour Setlist: Are Fans Getting Enough Hits?",Negative
"Security Concerns Rise Ahead of Taylor Swift's Era's Tour Kickoff",Negative
"Era's Tour Facing Technical Challenges: Will Taylor Swift's Team Address Issues?",Negative
"Critics Praise Taylor Swift's Era's Tour as a Must-See Event of the Year",Positive
"Fans Celebrate Taylor Swift's Era's Tour Announcement: 'Can't Wait to See Her Live!'",Positive
"Era's Tour Merchandise Line Unveiled: Fans Flock to Get Their Hands on Exclusive Items",Positive
"Taylor Swift's Era's Tour Receives Rave Reviews: Critics Applaud Spectacular Performances",Positive
"Taylor Swift's Era's Tour Takes Fans on an Unforgettable Journey Through Her Music",Positive
"Taylor Swift Delights Fans with Surprise Guests at Era's Tour Stops",Positive
"Fans Overflow with Emotion as Taylor Swift Performs Classics on Era's Tour",Positive
"Taylor Swift's Era's Tour Merchandise Line Breaks Records: Fans Can't Get Enough",Positive
"Taylor Swift's Era's Tour Sells Out Stadiums Across the Globe",Positive
"Taylor Swift Engages with Fans During Era's Tour Meet-and-Greets: Heartwarming Moments Captured",Positive
"Taylor Swift's Era's Tour Inspires Thousands with Messages of Love and Resilience",Positive
"Taylor Swift's Era's Tour Leaves a Lasting Impact on Fans: Memories to Cherish Forever",Positive
"Taylor Swift Wows Audiences with Jaw-Dropping Performances on Era's Tour",Positive
"Controversy Erupts as Taylor Swift's Era's Tour Ticket Prices Soar",Negative
"Taylor Swift Faces Criticism Over VIP Treatment on Era's Tour: Fans Express Discontent",Negative
"Disappointment Looms as Taylor Swift Cancels Era's Tour Dates Due to Unforeseen Circumstances",Negative
"Security Breach Raises Concerns at Taylor Swift's Era's Tour Venue: Safety Measures Under Scrutiny",Negative
"Taylor Swift's Era's Tour Plagued by Technical Glitches: Fans Express Frustration",Negative
"Taylor Swift's Era's Tour Faces Legal Challenges Over Copyright Infringement Claims",Negative
"Ticketing System Crashes Amid High Demand for Taylor Swift's Era's Tour: Chaos Ensues",Negative
"Taylor Swift's Era's Tour Merchandise Recalled Due to Quality Issues: Fans Disappointed",Negative
"Taylor Swift's Era's Tour Draws Criticism for Lack of Diversity in Lineup",Negative
"Fans Left Disheartened as Taylor Swift's Era's Tour Comes to an Abrupt End",Negative